,Rank,RatingTomatometer,Title,No. of Reviews,Rating,Genre,Original Language,Director,Producer,Writer,Release Date (Theaters),Release Date (Streaming),Box Office (Gross USA),Runtime,Distributor,Sound Mix,Aspect Ratio,View the collection
Toy Story 4 (2019),1.0,97%,Toy Story 4 (2019),453,G,"Fantasy, Animation, Kids & family, Adventure, Comedy",English,Josh Cooley,"Mark Nielsen, Jonas Rivera, Galyn Susman","Andrew Stanton, Stephany Folsom","Jun 21, 2019 wide","Oct 1, 2019",$434.0M,1h 40m,Walt Disney,"DTS, Dolby Digital, Dolby Atmos",Scope (2.35:1),Pixar
Spider-Man: Into the Spider-Verse (2018),2.0,97%,Spider-Man: Into the Spider-Verse (2018),393,PG (Mild Language|Frenetic Action Violence|Thematic Elements),"Fantasy, Animation, Action, Kids & family, Adventure, Comedy",English,"Bob Persichetti, Peter Ramsey, Rodney Rothman","Avi Arad, Amy Pascal, Phil Lord, Chris Miller, Christina Steinberg","Phil Lord, Rodney Rothman","Dec 14, 2018 wide","Mar 19, 2019",$190.2M,1h 57m,"Sony Pictures Entertainment, Columbia Pictures","Dolby Atmos, DTS, Dolby Digital, SDDS",Scope (2.35:1),
Inside Out (2015),3.0,98%,Inside Out (2015),379,PG (Some Action|Mild Thematic Elements),"Kids & family, Comedy, Fantasy, Animation",English,Pete Docter,Jonas Rivera,"Pete Docter, Meg LeFauve, Josh Cooley","Jun 19, 2015 wide","Nov 3, 2015",$2.0M,1h 35m,Walt Disney,"Dolby Atmos, Datasat",,Pixar
Coco (2017),4.0,97%,Coco (2017),354,PG (Thematic Elements),"Adventure, Comedy, Animation, Music",English,Lee Unkrich,Darla K. Anderson,"Adrian Molina, Matthew Aldrich","Nov 22, 2017 wide","Feb 13, 2018",$210.5M,1h 49m,Walt Disney,Dolby Atmos,Scope (2.35:1),Pixar
Snow White and the Seven Dwarfs (1937),5.0,98%,Snow White and the Seven Dwarfs (1937),54,G,"Kids & family, Fantasy, Animation",English,David Hand,Walt Disney,"Ted Sears, Richard Creedon, Otto Englander, Dick Rickard, Earl Hurd, Merrill De Maris, Webb Smith",,"Nov 16, 2004",,1h 20m,,Stereo,,
