,Rank,RatingTomatometer,Title,No. of Reviews,Rating,Genre,Original Language,Director,Producer,Writer,Release Date (Theaters),Release Date (Streaming),Box Office (Gross USA),Runtime,Distributor,Sound Mix,Aspect Ratio,View the collection
It Happened One Night (1934),1.0,99%,It Happened One Night (1934),98,,"Comedy, Romance",English,Frank Capra,"Frank Capra, Harry Cohn","Samuel Hopkins Adams, Robert Riskin","Feb 22, 1934 original","Dec 28, 1999",,1h 45m,"Columbia Pictures, Columbia TriStar Home Video, RCA/Columbia",Mono,"35mm, Flat (1.37:1)",
Citizen Kane (1941),2.0,99%,Citizen Kane (1941),121,PG,Drama,English,Orson Welles,Orson Welles,"Herman J. Mankiewicz, Orson Welles, John Houseman","May 1, 1941 wide","Feb 23, 2010",$977.3K,1h 59m,RKO Radio Pictures,Mono,Academy (1.33:1),
The Wizard of Oz (1939),3.0,98%,The Wizard of Oz (1939),160,G,"Fantasy, Musical",English,Victor Fleming,"Victor Fleming, Mervyn LeRoy","L. Frank Baum, Noel Langley, Florence Ryerson, Edgar Allan Woolf","Aug 25, 1939 wide","Aug 12, 2003",$5.5M,1h 41m,Metro-Goldwyn-Mayer,Mono,Flat (1.37:1),
Modern Times (1936),4.0,98%,Modern Times (1936),109,G,Comedy,English,Charlie Chaplin,Charlie Chaplin,Charlie Chaplin,"Feb 5, 1936 wide","Nov 16, 2010",$163.2K,1h 29m,United Artists,Mono,Flat (1.37:1),
Casablanca (1942),5.0,99%,Casablanca (1942),124,PG,Drama,English,Michael Curtiz,Hal B. Wallis,"Murray Burnett, Joan Alison, Julius J. Epstein, Philip G. Epstein, Howard Koch","Jan 23, 1943 wide","Nov 17, 1998",,1h 42m,Warner Bros. Pictures,Mono,Flat (1.37:1),
Sunset Boulevard (1950),6.0,98%,Sunset Boulevard (1950),110,,Drama,English,Billy Wilder,Charles Brackett,"Charles Brackett, D.M. Marshman Jr., Billy Wilder","Aug 10, 1950 wide","Nov 11, 2008",,1h 50m,Paramount Pictures,,Flat (1.37:1),
All About Eve (1950),7.0,99%,All About Eve (1950),103,,Drama,English,Joseph L. Mankiewicz,Darryl F. Zanuck,Joseph L. Mankiewicz,"Oct 13, 1950 original","Feb 5, 2004",$10.2K,2h 18m,"20th Century Fox, Fox",Mono,Flat (1.37:1),
The Cabinet of Dr. Caligari (Das Cabinet des Dr. Caligari) (1920),8.0,99%,The Cabinet of Dr. Caligari (Das Cabinet des Dr. Caligari) (1920),68,,"Fantasy, Mystery & thriller, Horror",German,Robert Wiene,"Rudolf Meinert, Erich Pommer","Hans Janowitz, Carl Mayer","Mar 19, 1921 wide","Feb 16, 1999",,1h 9m,"Grapevine Video, Kino Video",,,
The Philadelphia Story (1940),9.0,100%,The Philadelphia Story (1940),102,,"Comedy, Romance",English,George Cukor,Joseph L. Mankiewicz,"Philip Barry, Donald Ogden Stewart, Waldo Salt","Dec 1, 1940 original","May 16, 2000",,1h 52m,Metro-Goldwyn-Mayer,Mono,,
Rebecca (1940),10.0,100%,Rebecca (1940),95,,Mystery & thriller,English,Alfred Hitchcock,David O. Selznick,"Daphne Du Maurier, Philip MacDonald, Michael Hogan, Robert E. Sherwood, Joan Harrison, Barbara Keon","Apr 12, 1940 wide","Oct 14, 2008",,2h 10m,United Artists,Mono,Flat (1.37:1),
His Girl Friday (1940),11.0,99%,His Girl Friday (1940),100,,Comedy,English,Howard Hawks,Howard Hawks,"Ben Hecht, Charles MacArthur, Charles Lederer","Jan 11, 1940 original","Nov 21, 2000",,1h 32m,Columbia Pictures,Mono,35mm,
A Night at the Opera (1935),12.0,97%,A Night at the Opera (1935),70,,Comedy,English,Sam Wood,,,"Nov 15, 1935 original","May 4, 2004",,1h 33m,Metro-Goldwyn-Mayer,,,
The Third Man (1949),13.0,99%,The Third Man (1949),86,,Mystery & thriller,English,Carol Reed,"Alexander Korda, Carol Reed, David O. Selznick","Graham Greene, Alexander Korda, Graham Greene","Feb 1, 1949 wide","Oct 28, 2008",$447.0K,1h 44m,"Vintage Video, Selznick International Pictures, Spiegel Media GmbH, Continental Home Vídeo [br], British Lion Films Ltd., Warner Home Vídeo",Mono,Flat (1.37:1),
Rear Window (1954),14.0,98%,Rear Window (1954),122,PG,Mystery & thriller,English,Alfred Hitchcock,Alfred Hitchcock,"John Michael Hayes, Cornell Woolrich","Sep 1, 1954 wide","Sep 7, 2004",$1.6M,1h 52m,Paramount Pictures,,Flat (1.37:1),
Seven Samurai (Shichinin no Samurai) (1956),15.0,100%,Seven Samurai (Shichinin no Samurai) (1956),88,,Action,Japanese,Akira Kurosawa,Sojiro Motoki,"Shinobu Hashimoto, Akira Kurosawa, Hideo Oguni","Nov 19, 1956 wide","Sep 5, 2006",$271.7K,3h 28m,Columbia Pictures,Mono,Flat (1.37:1),
La Grande illusion (Grand Illusion) (1938),16.0,97%,La Grande illusion (Grand Illusion) (1938),68,,"Drama, War",French (Canada),Jean Renoir,"Albert Pinkovitch, Frank Rollmer",,"Sep 12, 1937 wide","Nov 23, 1999",$516.5K,1h 57m,"Home Vision Entertainment, Barr Entertainment",,,
Singin' in the Rain (1952),17.0,100%,Singin' in the Rain (1952),67,G,"Musical, Comedy",English,"Stanley Donen, Gene Kelly",Arthur Freed,"Betty Comden, Adolph Green","Apr 10, 1952 wide","Sep 24, 2002",$23.9K,1h 42m,Metro-Goldwyn-Mayer,Mono,Flat (1.37:1),
All Quiet on the Western Front (1930),18.0,98%,All Quiet on the Western Front (1930),81,,War,English,Lewis Milestone,Carl Laemmle Jr.,"Erich Maria Remarque, George Abbott, Del Andrews, Maxwell Anderson, Maxwell Anderson, Lewis Milestone","Aug 24, 1930 original","Feb 6, 2007",,1h 45m,Universal Pictures,,,
Snow White and the Seven Dwarfs (1937),19.0,98%,Snow White and the Seven Dwarfs (1937),54,G,"Kids & family, Fantasy, Animation",English,David Hand,Walt Disney,"Ted Sears, Richard Creedon, Otto Englander, Dick Rickard, Earl Hurd, Merrill De Maris, Webb Smith",,"Nov 16, 2004",,1h 20m,,Stereo,,
On the Waterfront (1954),20.0,99%,On the Waterfront (1954),107,,Drama,English,Elia Kazan,Sam Spiegel,"Budd Schulberg, Budd Schulberg","Jul 28, 1954 original","Oct 23, 2001",,1h 48m,Columbia Pictures,Mono,35mm,
An American in Paris (1951),21.0,96%,An American in Paris (1951),94,,"Musical, Romance",English,Vincente Minnelli,Arthur Freed,Alan Jay Lerner,"Nov 9, 1951 wide","Dec 2, 2004",,1h 53m,Metro-Goldwyn-Mayer,Mono,Flat (1.37:1),
The Best Years of Our Lives (1946),22.0,98%,The Best Years of Our Lives (1946),91,,Drama,English,William Wyler,Samuel Goldwyn,"MacKinlay Kantor, Robert E. Sherwood","Nov 21, 1946 wide","Jul 18, 2000",,2h 52m,RKO Radio Pictures,Mono,Flat (1.37:1),
Metropolis (1927),23.0,97%,Metropolis (1927),135,,"Drama, Sci-fi",German,Fritz Lang,Erich Pommer,"Fritz Lang, Thea von Harbou, Thea von Harbou","Mar 13, 1927 original","Mar 22, 2007",$1.2M,2h 3m,Paramount Pictures,"Dolby SR, Dolby Digital, Dolby A, Dolby Stereo",Flat (1.85:1),
The Kid (1921),24.0,100%,The Kid (1921),49,,"Drama, Comedy",English,Charlie Chaplin,Charlie Chaplin,Charlie Chaplin,"Jan 21, 1921 original","May 1, 2005",,1h 0m,,,,
"Nosferatu, a Symphony of Horror (Nosferatu, eine Symphonie des Grauens) (Nosferatu the Vampire) (1922)",25.0,97%,"Nosferatu, a Symphony of Horror (Nosferatu, eine Symphonie des Grauens) (Nosferatu the Vampire) (1922)",69,,"Fantasy, Horror",German,F.W. Murnau,"Enrico Dieckmann, Albin Grau","Henrik Galeen, Bram Stoker","Mar 5, 1922 original","Jan 2, 2001",,1h 5m,"Image Entertainment Inc., Republic Pictures, Hollywood's Attic, GoodTimes Home Video [us], Sinister Cinema, Grapevine Video, Video Yesteryear, Reel Media International [us], BijouFlix Releasing, Kino Video",,"Academy (1.33:1), 35mm",
The Adventures of Robin Hood (1938),26.0,100%,The Adventures of Robin Hood (1938),48,PG,"Adventure, Action",English,"Michael Curtiz, William Keighley",Hal B. Wallis,"Norman Reilly Raine, Seton I. Miller","Feb 11, 1938 wide","Sep 30, 2003",,1h 42m,Warner Bros. Pictures,Mono,Flat (1.37:1),
North by Northwest (1959),27.0,97%,North by Northwest (1959),109,,Mystery & thriller,English,Alfred Hitchcock,Alfred Hitchcock,Ernest Lehman,"Jul 17, 1959 wide","Nov 3, 2009",,2h 16m,Metro-Goldwyn-Mayer,Mono,Flat (1.66:1),
Laura (1944),28.0,100%,Laura (1944),65,,Mystery & thriller,English,Otto Preminger,Otto Preminger,"Jay Dratler, Samuel Hoffenstein, Elizabeth Reinhardt","Oct 11, 1944 original","Mar 15, 2005",,1h 28m,,,,
King Kong (1933),29.0,98%,King Kong (1933),66,,"Fantasy, Adventure",English,"Merian C. Cooper, Ernest B. Schoedsack","Merian C. Cooper, Ernest B. Schoedsack","James Ashmore Creelman, Ruth Rose","Mar 2, 1933 original","Nov 22, 2005",,1h 40m,RKO Radio Pictures,,,
Shadow of a Doubt (1943),30.0,100%,Shadow of a Doubt (1943),49,PG,"Drama, Mystery & thriller, Crime",English,Alfred Hitchcock,Jack H. Skirball,"Gordon McDonell, Thornton Wilder, Sally Benson, Alma Reville","Jan 1, 1943 wide","Oct 4, 2005",,1h 48m,Universal Pictures,Mono,Flat (1.37:1),
Psycho (1960),31.0,96%,Psycho (1960),105,R,"Mystery & thriller, Horror",English,Alfred Hitchcock,Alfred Hitchcock,"Robert Bloch, Joseph Stefano","Jun 16, 1960 original","Oct 4, 2005",,1h 49m,Paramount Pictures,Mono,,
A Hard Day's Night (1964),32.0,98%,A Hard Day's Night (1964),112,G,"Musical, Comedy",English,Richard Lester,Walter Shenson,Alun Owen,"Aug 11, 1964 wide","Sep 24, 2002",,1h 23m,Miramax Films,"Stereo, Surround",Flat (1.66:1),
The Bridge on the River Kwai (1957),33.0,96%,The Bridge on the River Kwai (1957),93,PG,"Drama, War",English,David Lean,Sam Spiegel,"Pierre Boulle, Michael Wilson, Carl Foreman","Dec 18, 1957 wide","Nov 21, 2000",,2h 41m,Columbia Pictures,"Surround, Mono, Magnetic Stereo 6 Track, Stereo",Scope (2.35:1),
Top Hat (1935),34.0,100%,Top Hat (1935),42,,"Musical, Romance",English,Mark Sandrich,Pandro S. Berman,"Aladar Laszlo, Károly Nóti, Allan Scott, Dwight Taylor","Sep 6, 1935 wide","Aug 16, 2005",,1h 39m,RKO Radio Pictures,Mono,Flat (1.37:1),
The Bride of Frankenstein (1935),35.0,98%,The Bride of Frankenstein (1935),47,,Horror,English,James Whale,Carl Laemmle Jr.,"William Hurlbut, John L. Balderston, Mary Shelley","Apr 22, 1935 wide","Aug 28, 2001",,1h 15m,"Realart Pictures Inc., Universal International Pictures, MCA/Universal Pictures [us], Universal Pictures, Film Classics Inc., Universal Home Entertainment",Mono,,
12 Angry Men (Twelve Angry Men) (1957),36.0,100%,12 Angry Men (Twelve Angry Men) (1957),58,,Drama,English,Sidney Lumet,"Henry Fonda, Reginald Rose",Reginald Rose,"Apr 20, 1957 original","Mar 4, 2008",,1h 35m,"Metro-Goldwyn-Mayer, MGM/UA Home Entertainment Inc., United Artists, Criterion Collection",,,
Marty (1955),37.0,99%,Marty (1955),70,,Drama,English,Delbert Mann,Harold Hecht,"Paddy Chayefsky, Paddy Chayefsky","May 21, 1955 wide","Oct 5, 2010",,1h 31m,United Artists,Mono,Flat (1.37:1),
The Lady Eve (1941),38.0,100%,The Lady Eve (1941),48,,"Comedy, Romance",English,Preston Sturges,Paul Jones,"Monckton Hoffe, Preston Sturges","Feb 25, 1941 original","Oct 16, 2001",,1h 37m,"Criterion Collection, Paramount Pictures",Mono,"35mm, Flat (1.37:1)",
The Treasure of the Sierra Madre (1948),39.0,100%,The Treasure of the Sierra Madre (1948),52,,"Drama, Adventure, Western",English,John Huston,Henry Blanke,"B. Traven, John Huston","Jan 6, 1948 original","Sep 30, 2003",,2h 4m,"Warner Bros. Pictures, MGM/UA Home Entertainment Inc.",,,
Lawrence of Arabia (1962),40.0,94%,Lawrence of Arabia (1962),124,PG,"Drama, Adventure, Biography, History",English,David Lean,"Robert A. Harris, Sam Spiegel","Robert Bolt, Michael Wilson","Dec 16, 1962 original","Apr 3, 2001",$6.0M,3h 36m,"Columbia Tristar, RCA Home Video, Criterion Collection, Columbia TriStar Home Video",Surround,,
Chinatown (1974),41.0,99%,Chinatown (1974),76,R,"Drama, Crime",English,Roman Polanski,Robert Evans,"Robert Towne, Roman Polanski","Jun 20, 1974 original","Nov 23, 1999",,2h 11m,Paramount Pictures,Mono,,
The Lady Vanishes (1938),42.0,98%,The Lady Vanishes (1938),45,,Mystery & thriller,English (United Kingdom),Alfred Hitchcock,Edward Black,"Ethel Lina White, Sidney Gilliat, Frank Launder","Nov 1, 1938 wide","Jul 25, 2000",,1h 37m,"Gaumont British Distributors, Criterion Collection, Metro-Goldwyn-Mayer Distributing Corp.",Mono,35mm,
Dr. Strangelove Or How I Learned to Stop Worrying and Love the Bomb (1964),43.0,98%,Dr. Strangelove Or How I Learned to Stop Worrying and Love the Bomb (1964),93,PG,Comedy,English,Stanley Kubrick,Stanley Kubrick,"Stanley Kubrick, Terry Southern, Peter George","Jan 29, 1964 wide","Oct 21, 2003",,1h 33m,Columbia Pictures,Mono,Flat (1.85:1),
All the King's Men (1949),44.0,97%,All the King's Men (1949),70,,Drama,English,Robert Rossen,Robert Rossen,Robert Rossen,"Nov 8, 1949 wide","Jun 5, 2001",,1h 49m,Columbia Pictures,Mono,Flat (1.37:1),
The 39 Steps (1935),45.0,96%,The 39 Steps (1935),53,,Mystery & thriller,English (United Kingdom),Alfred Hitchcock,"Michael Balcon, Ivor Montagu","John Buchan, Charles Bennett, Ian Hay","Jun 18, 1935 original","Nov 2, 1999",,1h 20m,"LS Video, Gaumont British Distributors, Grapevine Video",Mono,,
Frankenstein (1931),46.0,100%,Frankenstein (1931),52,,Horror,English,James Whale,Carl Laemmle Jr.,"Mary Shelley, Peggy Webling, John L. Balderston, Francis Edward Faragoh","Nov 21, 1931 wide","Aug 17, 1999",,1h 11m,"MCA/Universal Pictures [us], Universal Pictures, Screen Gems, Universal Home Entertainment, Realart Pictures Inc.",Mono,,
The Thin Man (1934),47.0,98%,The Thin Man (1934),43,,"Drama, Comedy",English,W. S. Van Dyke II,Hunt Stromberg,"Dashiell Hammett, Albert Hackett, Frances Goodrich","Jun 1, 1934 wide","Aug 2, 2005",,1h 33m,Metro-Goldwyn-Mayer,,,
The Gold Rush (1925),48.0,100%,The Gold Rush (1925),50,,"Drama, Adventure, Comedy",English,Charlie Chaplin,Charlie Chaplin,Charlie Chaplin,"Jun 26, 1925 wide","Jun 12, 2012",,1h 22m,United Artists,,Academy (1.33:1),
Battleship Potemkin (1925),49.0,100%,Battleship Potemkin (1925),49,,"Drama, Mystery & thriller, History",Russian,Sergei M. Eisenstein,Jacob Bliokh,"Nina Agadzhanova, Nikolay Aseev, Sergei M. Eisenstein, Sergei Tretyakov","Dec 5, 1926 original","Nov 4, 2003",$51.0K,1h 7m,"Amkino Corporation, Reel Media International [us], Grapevine Video, Image Entertainment Inc.",,Academy (1.33:1),
A Streetcar Named Desire (1951),50.0,97%,A Streetcar Named Desire (1951),63,PG,Drama,English,Elia Kazan,Charles K. Feldman,"Oscar Saul, Tennessee Williams, Tennessee Williams","Jan 1, 1951 wide","Sep 4, 2007",,2h 2m,Warner Bros. Pictures,,Flat (1.37:1),
Touch of Evil (1958),51.0,95%,Touch of Evil (1958),79,,"Drama, Mystery & thriller, Crime",English,Orson Welles,Albert Zugsmith,"Orson Welles, Paul Monash, Franklin Coen",,"Jul 6, 2004",,1h 35m,,,,
Kind Hearts and Coronets (1949),52.0,100%,Kind Hearts and Coronets (1949),47,,"Drama, Comedy, Crime",English,Robert Hamer,John Dighton,"Roy Horniman, Robert Hamer, John Dighton","Jun 14, 1950 wide","Feb 28, 2006",$35.9K,1h 44m,"Anchor Bay Entertainment, General Film Distributors, Eagle-Lion Films Inc. [us]",,,
Rashômon (1951),53.0,98%,Rashômon (1951),56,,Drama,Japanese,Akira Kurosawa,Minoru Jingo,"Ryûnosuke Akutagawa, Shinobu Hashimoto, Akira Kurosawa","Dec 26, 1950 wide","Apr 2, 2002",,1h 28m,RKO Radio Pictures,Mono,Academy (1.33:1),
It's a Wonderful Life (1946),54.0,94%,It's a Wonderful Life (1946),90,PG (Some Violence|Smoking|Thematic Elements),"Drama, Comedy, Other",English,Frank Capra,Frank Capra,"Frances Goodrich, Albert Hackett, Frank Capra, Philip Van Doren Stern, Jo Swerling","Jan 7, 1946 wide","Jul 13, 2004",$3.3M,2h 9m,RKO Radio Pictures,,Flat (1.37:1),
Vertigo (1958),55.0,94%,Vertigo (1958),84,PG,Mystery & thriller,English,Alfred Hitchcock,Alfred Hitchcock,"Pierre Boileau, Thomas Narcejac, Samuel A. Taylor, Alec Coppel","May 9, 1958 wide","Jan 25, 2001",$1.8M,2h 8m,Paramount Pictures,,Flat (1.85:1),
The Last Picture Show (1971),56.0,100%,The Last Picture Show (1971),60,R (Nudity|Language|Sexuality),Drama,English,Peter Bogdanovich,Stephen Friedman,"Peter Bogdanovich, Larry McMurtry, Larry McMurtry","Jan 1, 1971 wide","Nov 30, 1999",,1h 58m,Columbia Pictures,Mono,,
The Red Shoes (1948),57.0,97%,The Red Shoes (1948),62,,"Drama, Romance",English (United Kingdom),"Michael Powell, Emeric Pressburger","Michael Powell, Emeric Pressburger","Hans Christian Andersen, Michael Powell, Emeric Pressburger, Keith Winter, Marius Goring","Sep 6, 1948 original","Mar 1, 2001",,2h 13m,"Criterion Collection, MCA/Universal Pictures [us]",Mono,,
Scarface (1932),58.0,98%,Scarface (1932),46,PG,"Drama, Crime",English,Howard Hawks,,,,"Jul 8, 2008",,1h 33m,,,,
The Grapes of Wrath (1940),59.0,100%,The Grapes of Wrath (1940),48,,Drama,English,John Ford,Darryl F. Zanuck,Nunnally Johnson,"Mar 15, 1940 original","Apr 6, 2004",,2h 9m,20th Century Fox,,,
The Lost Weekend (1945),60.0,97%,The Lost Weekend (1945),62,,Drama,English,Billy Wilder,Charles Brackett,"Charles R. Jackson, Charles Brackett, Billy Wilder","Nov 16, 1945 wide","Feb 1, 2005",,1h 41m,Paramount Pictures,Mono,Flat (1.37:1),
The Big Sleep (1946),61.0,97%,The Big Sleep (1946),65,,"Drama, Mystery & thriller, Crime",English,Howard Hawks,Howard Hawks,"William Faulkner, Leigh Brackett, Jules Furthman","Aug 31, 1946 original","Feb 15, 2000",,1h 54m,Warner Bros.,,,
Goldfinger (1964),62.0,99%,Goldfinger (1964),69,PG,Action,English,Guy Hamilton,"Albert R. Broccoli, Harry Saltzman","Ian Fleming, Richard Maibaum, Paul Dehn","Dec 25, 1964 wide","Nov 7, 2006",,1h 52m,United Artists,Mono,Flat (1.85:1),James Bond 007
Cool Hand Luke (1967),63.0,100%,Cool Hand Luke (1967),53,PG,Drama,English,Stuart Rosenberg,Gordon Carroll,"Frank Pierson, Donn Pearce, Donn Pearce","Nov 1, 1967 wide","Jun 24, 1997",,2h 9m,"Warner Home Vídeo, Warner Bros. Pictures",Mono,Scope (2.35:1),
The 400 Blows (Les Quatre cents coups) (1959),64.0,98%,The 400 Blows (Les Quatre cents coups) (1959),66,,"Drama, Crime",French (France),François Truffaut,François Truffaut,"François Truffaut, François Truffaut, Marcel Moussy","Nov 16, 1959 wide","May 9, 2006",,1h 33m,Criterion Collection,Mono,,
Anatomy of a Murder (1959),65.0,100%,Anatomy of a Murder (1959),50,,"Drama, Mystery & thriller, Crime",English,Otto Preminger,Otto Preminger,"John D. Voelker, Wendell Mayes","Jul 1, 1959 original","Jul 11, 2000",,2h 40m,Columbia Pictures,Mono,Flat (1.85:1),
Stagecoach (1939),66.0,100%,Stagecoach (1939),45,,Western,English,John Ford,John Ford,"Ernest Haycox, Dudley Nichols, Ben Hecht","Mar 2, 1939 wide","Sep 3, 2002",,1h 36m,"UCLA Film and Television Archive [us], United Artists, Warner Home Vídeo",,Flat (1.37:1),
Invasion of the Body Snatchers (1956),67.0,98%,Invasion of the Body Snatchers (1956),58,,"Sci-fi, Horror",English,Don Siegel,Walter Wanger,Daniel Mainwaring,"Feb 5, 1956 original","Jun 23, 1998",,1h 20m,,,,
The Passion of Joan of Arc (La Passion de Jeanne d'Arc) (1928),68.0,98%,The Passion of Joan of Arc (La Passion de Jeanne d'Arc) (1928),59,,"Drama, Biography, History",,Carl Theodor Dreyer,,"Carl Theodor Dreyer, Joseph Delteil","Apr 21, 1928 original","Nov 9, 1999",$6.4K,1h 17m,"Criterion Collection, Video Yesteryear, Janus Films, LS Video",,35mm,
Sweet Smell of Success (1957),69.0,98%,Sweet Smell of Success (1957),55,,Drama,English,Alexander Mackendrick,James Hill,"Ernest Lehman, Clifford Odets","Jun 27, 1957 wide","Jun 19, 2001",,1h 36m,"MGM/UA Home Entertainment Inc., United Artists",Mono,,
Paths of Glory (1957),70.0,96%,Paths of Glory (1957),68,,"War, Drama",English,Stanley Kubrick,"Kirk Douglas, James B. Harris","Humphrey Cobb, Stanley Kubrick, Calder Willingham, Jim Thompson","Oct 25, 1957 original","May 1, 2001",,1h 26m,"Criterion Collection, United Artists, MGM/UA Home Entertainment Inc.","Mono, Stereo","Flat (1.37:1), 35mm",
The French Connection (1971),71.0,96%,The French Connection (1971),85,R,"Drama, Mystery & thriller, Crime",English,William Friedkin,Philip D'Antoni,Ernest Tidyman,"Oct 7, 1971 original","Feb 1, 2005",,1h 44m,20th Century Fox,,,
Roman Holiday (1953),72.0,97%,Roman Holiday (1953),60,,"Comedy, Romance",English,William Wyler,William Wyler,"Dalton Trumbo, Ian McLellan Hunter, John Dighton","Aug 27, 1953 original","Nov 26, 2002",,1h 59m,Paramount Pictures,Mono,,
Freaks (1932),73.0,95%,Freaks (1932),55,,Horror,English,Tod Browning,"Tod Browning, Dwain Esper, Hildegarde Stadie, Irving Thalberg","Al Boasberg, Willis Goldbeck, Leon Gordon, Edgar Allan Woolf","Feb 20, 1932 original","May 19, 2009",,1h 4m,Metro-Goldwyn-Mayer,"Stereo, Mono","35mm, Flat (1.37:1)",
Bringing Up Baby (1938),74.0,94%,Bringing Up Baby (1938),51,,Comedy,English,Howard Hawks,Howard Hawks,"Hagar Wilde, Dudley Nichols, Hagar Wilde","Feb 18, 1938 wide","Mar 1, 2005",,1h 42m,RKO Radio Pictures,Mono,,
2001: A Space Odyssey (1968),75.0,92%,2001: A Space Odyssey (1968),114,G,Sci-fi,English,Stanley Kubrick,Stanley Kubrick,"Arthur C. Clarke, Stanley Kubrick","Apr 2, 1968 original","Oct 23, 2007",$1.3M,2h 19m,"Metro-Goldwyn-Mayer, Criterion Collection, Warner Home Vídeo, Warner Bros.","Magnetic Stereo 6 Track, Mono, Stereo",70mm,
In the Heat of the Night (1967),76.0,95%,In the Heat of the Night (1967),83,,"Drama, Crime",English,Norman Jewison,Walter Mirisch,Stirling Silliphant,"Aug 2, 1967 wide","Jan 9, 2001",,1h 49m,MGM/UA Home Entertainment Inc.,,Flat (1.85:1),
In a Lonely Place (1950),77.0,98%,In a Lonely Place (1950),47,,Drama,English,Nicholas Ray,Robert Lord,"Dorothy B. Hughes, Edmund H. North, Andrew Solt","May 17, 1950 wide","Mar 18, 2003",,1h 31m,Columbia Pictures,Mono,"Flat (1.37:1), 35mm",
Night of the Living Dead (1968),78.0,96%,Night of the Living Dead (1968),75,,Horror,English,George A. Romero,"Karl Hardman, Russell Streiner","George A. Romero, John A. Russo","Oct 1, 1968 limited","Mar 1, 2001",$68.7K,1h 36m,"Elite Entertainment Inc., Reel Media International [us], United Video, Vestron Video, BijouFlix Releasing, Republic Pictures, UAV Entertainment, Master Movies, Continental Distributing Inc., Anchor Bay Entertainment, Navarre Entertainment, Something Weird Video, Image Entertainment Inc., Sinister Cinema",Mono,Academy (1.33:1),
Gentlemen Prefer Blondes (1953),79.0,98%,Gentlemen Prefer Blondes (1953),45,,"Musical, Comedy",English,Howard Hawks,Sol C. Siegel,"Joseph Fields, Anita Loos, Charles Lederer","Jul 18, 1953 wide","May 30, 2006",,1h 31m,20th Century Fox,Mono,,
Rosemary's Baby (1968),80.0,96%,Rosemary's Baby (1968),74,R,Horror,English,Roman Polanski,William Castle,"Roman Polanski, Ira Levin","Jun 12, 1968 wide","Oct 3, 2000",,2h 16m,Paramount Pictures,Mono,Flat (1.85:1),
Sunrise: A Song of Two Humans (1927),81.0,98%,Sunrise: A Song of Two Humans (1927),62,,"Drama, Romance",English,F.W. Murnau,William Fox,"Hermann Sudermann, Carl Mayer, Katherine Hilliker, H.H. Caldwell","Sep 23, 1927 wide","Oct 12, 2004",,1h 50m,"Critics' Choice Video, Fox",Mono,,
The Day the Earth Stood Still (1951),82.0,95%,The Day the Earth Stood Still (1951),57,G,Sci-fi,English,Robert Wise,Julian Blaustein,"Harry Bates, Edmund H. North","Sep 18, 1951 wide","Mar 2, 2004",,1h 32m,"Fox, CBS/Fox, 20th Century Fox",Mono,"35mm, Flat (1.37:1)",
Detour (1945),83.0,98%,Detour (1945),41,,"Drama, Crime",English,Edgar G. Ulmer,Leon Fromkess,,"Nov 30, 1945 original","Oct 22, 2002",$12.2K,1h 9m,,,,
Mrs. Miniver (1942),84.0,95%,Mrs. Miniver (1942),60,,Drama,English,William Wyler,"Sidney Franklin, William Wyler","George Froeschel, James Hilton, Jan Struther, Claudine West, Arthur Wimperis","Jun 4, 1942 wide","Feb 3, 2004",,2h 14m,Metro-Goldwyn-Mayer,Mono,Flat (1.37:1),
City Lights (1931),85.0,96%,City Lights (1931),55,G,"Drama, Comedy, Romance",,Charlie Chaplin,Charlie Chaplin,Charlie Chaplin,"Jan 30, 1931 original","Feb 23, 2010",$18.2K,1h 27m,United Artists,,35mm,
Miracle on 34th Street (1947),86.0,96%,Miracle on 34th Street (1947),48,,"Drama, Comedy, Other",English,George Seaton,William Perlberg,George Seaton,"May 2, 1947 original","Oct 5, 1999",,1h 36m,20th Century Fox,,,
Home of the Brave (1949),87.0,98%,Home of the Brave (1949),40,,War,English,Mark Robson,,,,"Oct 1, 2015",,1h 25m,,,,
Gone With the Wind (1939),88.0,90%,Gone With the Wind (1939),102,G,"Drama, History, Romance",English,Victor Fleming,David O. Selznick,Sidney Howard,"Dec 15, 1939 wide","Nov 17, 2009",$198.7M,3h 42m,Metro-Goldwyn-Mayer,"Surround, Mono",Flat (1.37:1),
Badlands (1974),89.0,97%,Badlands (1974),59,PG,"Drama, Crime",English,Terrence Malick,Terrence Malick,Terrence Malick,"Oct 15, 1973 original","Apr 27, 1999",,1h 35m,Warner Bros. Pictures,Mono,35mm,
Repulsion (1965),90.0,95%,Repulsion (1965),65,,Horror,English,Roman Polanski,Gene Gutowski,"Roman Polanski, Gérard Brach, David Stone",,"Feb 8, 2005",,1h 45m,,Mono,35mm,
The Leopard (1963),91.0,98%,The Leopard (1963),48,PG,"Drama, History",Italian,Luchino Visconti,Goffredo Lombardo,"Suso Cecchi d'Amico, Pasquale Festa Campanile, Enrico Medioli, Massimo Franciosa, Luchino Visconti","Jul 15, 1963 original","Jun 8, 2004",,2h 45m,20th Century Fox,Mono,35mm,
101 Dalmatians (1961),92.0,98%,101 Dalmatians (1961),52,G,"Kids & family, Adventure, Comedy, Animation",English,"Wolfgang Reitherman, Hamilton Luske, Clyde Geronimi",Walt Disney,"Bill Peet, Dodie Smith",,"Mar 4, 2008",$91.3M,1h 19m,,Surround,,
The Manchurian Candidate (1962),93.0,97%,The Manchurian Candidate (1962),60,PG-13,"Drama, Mystery & thriller",English,John Frankenheimer,"John Frankenheimer, George Axelrod",George Axelrod,"Oct 24, 1962 original","Jan 25, 2001",$1.9M,2h 6m,"MGM/UA Home Entertainment Inc., United Artists",,,
The Blue Angel (Der Blaue Engel) (1930),94.0,96%,The Blue Angel (Der Blaue Engel) (1930),45,,Drama,German,Josef von Sternberg,Erich Pommer,,"Jan 3, 1930 wide","Mar 6, 2007",,1h 34m,"Paramount Pictures, Image Entertainment Inc.",Mono,Academy (1.33:1),
Children of Paradise (Les Enfants du Paradis) (1946),95.0,98%,Children of Paradise (Les Enfants du Paradis) (1946),40,,Romance,French (France),Marcel Carné,Raymond Borderie,Jacques Prévert,"Nov 15, 1945 original","Jan 22, 2002",$31.9K,3h 15m,Criterion Collection,,,
Kiss Me Deadly (1955),96.0,98%,Kiss Me Deadly (1955),43,,"Drama, Crime",English,Robert Aldrich,Robert Aldrich,"Mickey Spillane, A. I. Bezzerides","May 18, 1955 original","Jun 19, 2001",$882,1h 45m,"Metro-Goldwyn-Mayer, United Artists, MGM/UA Home Entertainment Inc.",Mono,"35mm, 1.66:1",
Stormy Weather (1943),97.0,95%,Stormy Weather (1943),41,,Musical,English,Andrew L. Stone,William LeBaron,"Jerry Horwin, Frederick J. Jackson, Ted Koehler, H.S. Kraft, Seymour B. Robinson","Nov 17, 1943 original","Jan 10, 2006",,1h 17m,20th Century Fox,Mono,,
