,names,dates,scores,reviews
43,macharius39,"May 26, 2016",6,"A decent team-based shooter crippled by some serious problems. A short list:

-20 tick rate servers (20 refreshes per second). Modern FPS games used 60 tick or higher. This means that Blizzard cheaped out and is using a netcode model that was popular back when dial-up was still a thing. It also leads to a lot of unnecessary and frustrating deaths as the low update rate and their serverA decent team-based shooter crippled by some serious problems. A short list:

-20 tick rate servers (20 refreshes per second). Modern FPS games used 60 tick or higher. This means that Blizzard cheaped out and is using a netcode model that was popular back when dial-up was still a thing. It also leads to a lot of unnecessary and frustrating deaths as the low update rate and their server prediction algorithms kill you because your own reactions to situations fail to register in time. Considering the fast-paced nature of the game, this money-grubbing decision by Blizzard makes the game frustrating for anyone with any kind of FPS experience and skill. It is currently one of the most hotly debated topics on their message boards, which they are ignoring. This issue, if not addressed makes the idea of Overwatch becoming an e-sport a complete joke.

-Poor matchmaking (hopefully this sorts itself out as people supposedly have ratings that help them adjust their matchmaking accordingly) and accusations that they are using the same kind of matchmaking as Heroes of the Storm which forces people into games where they get stomped repeatedly if they win rate goes too high over 50%.

-RNG crackboxes for cosmetics. This is a pretty blatant cash grab and preys on the psychology behind gambling addition, which some people are susceptible to. They should have kept random loot boxes for leveling but allowed you to buy whatever skins/emotes/sprays you want like they do in Heroes of the Storm and World of Warcraft. This decision was probably forced upon them by Activision who aren't afraid to do anything to maximize profits.

-Hero stacking and poor hero balance. Some heroes are quite powerful while others are just meh. ""Pro"" teams stack the powerful ones. Some heroes are extremely cheesy when stacked, like Bastion and Torbjorn, to name two. There is currently no limit on how many of one specific hero can be used.

-Missing features at launch e.g. no Competitive Mode. Yet the cash shop works perfectly.

-Two-faced policy when it comes to banning cheaters. 2 ""pro"" players were busted for using aimbots in Overwatch competitive play. They were not banned and are still making streams, playing competitively and making bank from the game. Yet Blizzard states a zero-tolerance policy for cheating and claims to have banned people caught. So it seems like if you're a ""pro"" player and bring visibility to the game from an e-sports perspective and help Blizzard make more inroads into the e-sports scene, you are treated differently from everyone else.

The graphics, animations and sound are all excellent. The game looks good and runs well. If they can address the gameplay issues outlined above, the game is definitely one of the best shooters on the market but if they don't, it's going to sour the community fast.… Expand"
44,peneconsida,"May 26, 2016",0,"Me parece indignante que este juege tenga esta puntuación tan alta, osea es realmente abusivo. Un juego que no ofrece ningún modo de juego solamente online, con unos gráficos muy normalitos..Y encima tiene el semejante precio de 40 € en pc y 60 en consolas. Absolutamente los maletines vuelvan por aqui y despues los fanboys de blizzard son incapaces de dar una nota real a este juego. EsteMe parece indignante que este juege tenga esta puntuación tan alta, osea es realmente abusivo. Un juego que no ofrece ningún modo de juego solamente online, con unos gráficos muy normalitos..Y encima tiene el semejante precio de 40 € en pc y 60 en consolas. Absolutamente los maletines vuelvan por aqui y despues los fanboys de blizzard son incapaces de dar una nota real a este juego. Este juego no merece un 0 de nota, de acuerdo yo le daria un 5 pero no quiero que tenga una media tan alta.… Expand"
45,bwort007,"May 26, 2016",10,"Simple the best team shooter outside., Easy to get in , hard to master. dont beleave the haters, this game is a blast with friends. Blizzard did it again."
46,Frigidman,"May 26, 2016",8,"Overwatch is Blizzard's first new IP in quite a long time, and boy did they succeed. As a shooter, Overwatch has a little bit for everyone. I almost guarantee that anyone who plays it will enjoy at least one of the many different characters it has to offer. Whether you enjoy soaring through the skies as Pharah, healing and reviving teammates as Mercy, playing a more typical FPS characterOverwatch is Blizzard's first new IP in quite a long time, and boy did they succeed. As a shooter, Overwatch has a little bit for everyone. I almost guarantee that anyone who plays it will enjoy at least one of the many different characters it has to offer. Whether you enjoy soaring through the skies as Pharah, healing and reviving teammates as Mercy, playing a more typical FPS character like Soldier 76, or just sitting in place as a robotic turret holding down your mouse button for hours... You will find one at least.

In terms of content, Overwatch has four gamemodes in its standard quick play (Capture the point, King of the hill, Payload, and a Point-Payload hybrid), a vs. AI mode, custom lobbies, and a mode that changes each week which features crazy or fun rules on standard gameplay. And Blizzard has stated to expect a ranked mode sometime in mid-late June.

In terms of microtransactions, those are purely for cosmetics, so they hinder the game in no way. You'll never be disadvantaged against someone who bought 50 loot boxes... unless you get distracted by their pretty skins... Plus Blizzard has stated all future maps and characters will be free upon release.

I would definitely recommend Overwatch to anyone in the market for a good FPS, or even just a fun as hell game to play with your friends. With the standard edition only being $40, the pricing isn't that bad. If you fear there is too little content, I would say the game's replayability more than makes up for it as I have yet to be bored at all while playing.… Expand"
47,Orudomonki,"May 26, 2016",9,"Yoo guys it won't fcking help you guys all keep playing attack? WHO'S GOING TO GO SUPPORT? Or even tank? Yall think this some halo or call of duty type of sht and try to play fast, fck off mehn, play some support!

9/10"
48,Corey117,"May 26, 2016",9,"Positives:A fantastic example of how a team fps should be done. Everything in the game from the starting menu to the post-game report is polished to the point of perfection. I particularly love how Blizzard was able to use ideas from MOBA style games and flawlessly blend them into a regular team fps. All of the characters are unique in both their appearance and their play style makingPositives:A fantastic example of how a team fps should be done. Everything in the game from the starting menu to the post-game report is polished to the point of perfection. I particularly love how Blizzard was able to use ideas from MOBA style games and flawlessly blend them into a regular team fps. All of the characters are unique in both their appearance and their play style making every game you play a different experience (in a good way).

Negatives: Now with (almost) every game there is at least one negative and despite how crazy fun the multiplayer madness may be, it's still just multiplayer with not much of a backstory. Now i'm not just complaining about the fact that there is no story mode to play through I am referring to a lack of overall backstory in the game in general. Now of course you can always use sources like wiki and polygon's timeline (definitely recommend the timeline) to get the story but that is unfortunately the only way. Now don't let this discourage you to much because the game is still super fun to play and the gameplay does not get hurt by this but it is a feature that a lot of people wish were there.

Verdict: 9/10. A must buy for any fan of fps multiplayer. The lack of story content is not enough to make this game not worth the price of admission and you will certainly agree after you hit your 100th hour of gameplay with no sign of slowing down.… Expand"
49,dikiyKOPEK,"May 26, 2016",10,"This review contains spoilers, click expand to view.
        
I've put over 50 hours into this game. Many people have put in more - because they've had fun playing it. Got hooked on the beta. If you haven't played the beta, that's probably the only reason you don't already have the full game. In all seriousness, it does something that no other shooter on console has done successfully - created a fun, truly team based, engaging, competitive game that has a high skill ceiling with a low barrier to entry and lovable characters. On the surface it is simple, but play it for a while and you'll understand why Overwatch exceeds the hype.… Expand"
50,J-dam,"May 26, 2016",10,This game is absolutely phenomenal . Hands down amazing. The game play feels smooth and very well polished. It's also quite well balanced. Stop reading this review and go buy it!
51,Goncas2,"May 26, 2016",4,Will get boring in the first week. Almost no content. You are paying 40$ for a F2P game. Seem to like overwatch? go play tf2 instead. It has much more content and it's free.
52,Rollb,"May 26, 2016",10,"Overwtach has it all, it's simple enough to have fun as soon as you jump into the field, unique character design and playstyles, very nice maps, they are simple enough to understand them, but make no mistake, every map has a lot of secret paths, and places to be taken advantage depending who you playing. I give this game 11/10"
53,roofTip,"May 26, 2016",9,Game is already solid with quick matches and a variety of characters for all styles of gameplay. More things like competitive gameplay being added to put it inline with other Blizzard games.
54,rmatthendrick,"May 26, 2016",9,"This game is damn near perfect. The 21 characters are very well balanced and every match feels epic. My favorite aspect of the game is it's focus on team play instead of individual Kill/Death ratios and the like. The only issue I have is the ""Play of the Game"" at the end of every match goes to the one with best multi-kills, it goes against the spirit of the game and there are severalThis game is damn near perfect. The 21 characters are very well balanced and every match feels epic. My favorite aspect of the game is it's focus on team play instead of individual Kill/Death ratios and the like. The only issue I have is the ""Play of the Game"" at the end of every match goes to the one with best multi-kills, it goes against the spirit of the game and there are several tactics that deserve a much, if not more attention.… Expand"
55,PeJo10,"May 26, 2016",10,"I haven't had this much fun with a shooter since q3 or Unreal Tournament. Old-School but modern, I love it!

You also get all future characters, maps and game modes when buying, and a TON of loot boxes through leveling, which you do forever, meaning you don't have to spend a cent more after buying it, which is VERY refreshing in Today's pay2win game world"
56,Opecman,"May 26, 2016",2,absolute joke that this game is scoring as high as it is. made the mistake of playing the beta and then buying it not realizing i was getting nothing more with it. they essentially released an incomplete game with the lack of the competitive mode that they are releasing next month. the fact they put in micro-transactions for the loot boxes which are literally the only unlocks is a realabsolute joke that this game is scoring as high as it is. made the mistake of playing the beta and then buying it not realizing i was getting nothing more with it. they essentially released an incomplete game with the lack of the competitive mode that they are releasing next month. the fact they put in micro-transactions for the loot boxes which are literally the only unlocks is a real slap in the face too.  it is a sad world we live in that we as consumers continue to buy trash allowing these companies to keep putting out more.… Expand
57,Sevvy88,"May 26, 2016",9,"Blizzard still has it. When the studio puts their mind to it you can see the passion. Overwatch is lovely, fun, fast paced, addictive, challenging, and full of character.

People have been talking about the FPS genre becoming stale and on life support and we've watched even Battlefield devolve into a CoD clone to rake in easier dollars, but Overwatch stands on its own and apart. It hasBlizzard still has it. When the studio puts their mind to it you can see the passion. Overwatch is lovely, fun, fast paced, addictive, challenging, and full of character.

People have been talking about the FPS genre becoming stale and on life support and we've watched even Battlefield devolve into a CoD clone to rake in easier dollars, but Overwatch stands on its own and apart. It has an identity, and is original enough that the ""Team Fortress 2 clone"" accusations really have no basis.

Definitely pick this one up.… Expand"
58,Alexspier,"May 26, 2016",2,"It does have fun characters to play, but the game itself has absolutely no replay ability. There is no balance on maps and some characters are too powerful in the game that needs nerfs.  All the game modes are stolen from TF2, no clue why people are calling it a ""fresh"" FPS game. Pure waifu bait and amazing marketing strategy by masterminds at Blizzard."
59,GenericBlueToad,"May 26, 2016",9,"Okay, I don't usually write reviews but the people who are rating this 0 because its not free to play are annoying me. Why should this game be free to play? Its EXTREMELY polished. It's pretty clear that a lot of work went into this game. Do you want to work for free? People quote Team Fortress 2 being free to play, but what most people seem to forget is that Team Fortress 2 was originallyOkay, I don't usually write reviews but the people who are rating this 0 because its not free to play are annoying me. Why should this game be free to play? Its EXTREMELY polished. It's pretty clear that a lot of work went into this game. Do you want to work for free? People quote Team Fortress 2 being free to play, but what most people seem to forget is that Team Fortress 2 was originally not free to play.  Team Fortress 2 also had just as many single player options as Overwatch does.

I have a lot of fun playing this game. The characters are diverse and the maps are generally well designed. The only complaints I have is that a few characters/maps need to be balanced a little. Sometimes when you're attacking a point that has a big chokepoint, it's almost impossible to get through when there's 2 turrets and 2 bastions Guarding the entrance. It's still a lot of fun trying to push through it though, so I can't even truly complain about that.

Overall the game is well made and a lot of fun. Definitely worth the money i paid for it.… Expand"
60,RodZoron,"May 26, 2016",9,"I don't give this game a 10/10 simply because there is much more content that will be added in the near future, and surely make this game even better. Gameplay, art-work, level design, heroes, lore... Everything in this game is great. It's a very well polished game with great gameplay and story, which evidently shows with how much passion this game was created by the Blizzard folks.I don't give this game a 10/10 simply because there is much more content that will be added in the near future, and surely make this game even better. Gameplay, art-work, level design, heroes, lore... Everything in this game is great. It's a very well polished game with great gameplay and story, which evidently shows with how much passion this game was created by the Blizzard folks. Recommended for sure.… Expand"
61,FunkyExige,"May 26, 2016",9,"Played the beta and was worried i would not enjoy as i am very wary of games without campaign mode. However i was completely hooked. If you give this game a couple of days you can be sure you will be hooked for months to come! The only thing that is missing for me is a story mode, especially as blizzard has created amazing characters which you can really identify with. Get this game, itPlayed the beta and was worried i would not enjoy as i am very wary of games without campaign mode. However i was completely hooked. If you give this game a couple of days you can be sure you will be hooked for months to come! The only thing that is missing for me is a story mode, especially as blizzard has created amazing characters which you can really identify with. Get this game, it will not disappoint!… Expand"
62,Indrigis,"May 26, 2016",9,"To paraphrase three most common complaints from people giving negative reviews:

* Opened the menu on the ""Grill"" page, ordered a steak. Got a steak. But I wanted sushi and pancakes with a side of raspberry jam. 0/10.
* This steak brings nothing new to the table. It's just a mix of meat, spices and vegetables. I've eaten all of those before. 2/10.
* If I want my steak on an authenticTo paraphrase three most common complaints from people giving negative reviews:

* Opened the menu on the ""Grill"" page, ordered a steak. Got a steak. But I wanted sushi and pancakes with a side of raspberry jam. 0/10.
* This steak brings nothing new to the table. It's just a mix of meat, spices and vegetables. I've eaten all of those before. 2/10.
* If I want my steak on an authentic Ming dynasty dish or want gold-plated utensils, I have to pay extra, on top of paying for the steak. 4/10.

As far as reasonable expectations go, Overwatch is a damn fine steak, though.

The hero roster is great, the maps are well designed, the gameplay is very fluid and satisfying. Although there could be more game modes or some extra dynamic events on the maps, the package is quite solid as it is.

While cosmetic offerings do not come fast by leveling, you hardly need more than one (favorite) skin/voice line/spray for any character.… Expand"
63,Finalexp,"May 26, 2016",10,"One word: AMAZING! Overwatch really did this for me, and it's hands down the best game I've been playing in my entire 26 years of life.

Everything with Overwatch is just brilliant for me. The fast-phased environment, all the different playstyle characters, the FPS-view of the game and the fact that you have to be good as a team to succeed.

All other games that I thought I enjoyedOne word: AMAZING! Overwatch really did this for me, and it's hands down the best game I've been playing in my entire 26 years of life.

Everything with Overwatch is just brilliant for me. The fast-phased environment, all the different playstyle characters, the FPS-view of the game and the fact that you have to be good as a team to succeed.

All other games that I thought I enjoyed just became kinda dull and boring after the release of Overwatch. And the funniest part of it is that I didn't think much of it when I first saw it on streaming, but I have it a go at the beta - and I was stuck. Thinking of buying it? Just do it, purchase the best game ever released.

10/10, thank you Blizzard.… Expand"
64,archanjo,"May 26, 2016",10,most fun i had in years    .
65,Hupples,"May 26, 2016",6,"Presentation: 7
Gameplay: 5
Story: 5
Total: 5.7/10

Overhyped
Overpriced
Overrated
Overwatch by $Blizzard$
Hurry up and buy it before the next hype train arrives at the station."
66,ExpositionFairy,"May 26, 2016",8,"A surprisingly great take on FPS by Blizzard which, in my opinion, lives up to the hype. Here's why:

Pros:
- The game is easy to get into, yet hard to master. There are characters suited to all kinds and levels of playstyles - which I think is great! Each character feels unique to play, offering a diversity of experiences.
- To win in Overwatch, you need to have a good understandingA surprisingly great take on FPS by Blizzard which, in my opinion, lives up to the hype. Here's why:

Pros:
- The game is easy to get into, yet hard to master. There are characters suited to all kinds and levels of playstyles - which I think is great! Each character feels unique to play, offering a diversity of experiences.
- To win in Overwatch, you need to have a good understanding of how characters work together or against each other tactically, and how team comps compare to each other, as well as how you can strategically use the map to your advantage. However, your reflexes also make a contribution - for example, if you're good at aiming AND strategy, you can really shine with a hero like Tracer. Overwatch has just the right balance between these two contributing factors - it's not like a MOBA where almost everything is decided by tactics; and it's not CS:GO where aim is the largest influence.
- Because games are quite short, losses generally don't feel punishing, yet winning can be very exciting.
- When compared to a MOBA or a game like CS:GO, where your previous success has an influence on your future success (e.g. whether you have enough money to buy the items you need), in Overwatch this factor is eliminated completely, making last-minute comebacks possible and extremely satisfying.
- Overwatch's pay-to-play model guarantees that there will be no game-breaking factors in the future, as well as free content updates in the future as stated by the developers. It also ensures that people will be less prone to purchase new accounts in the future and break the game for newcomers. Finally, the P2P model holds a promise of a better community.

Cons:
- Netcode. In my opinion, this is the game's biggest issue at the moment. Currently, issues where you receive damage after you are already in cover or have used an escape ability are quite frequent. Blizzard will certainly have to do something about this when it comes to ranked play.
- Ranked play. It has not been released as of yet, so it is not fair to judge on this yet; however, if ranked is anything like the closed beta was, it will certainly need revisions if Overwatch wants to see a future in e-sports.

Neutral:
- The game is very fast-paced, which to some will feel very fun, yet to others may feel overwhelming.… Expand"
67,Rickswan,"May 26, 2016",5,"Overwatch is popular, and it scores highly. Is this because it's a mind-bendingly great game? I don't think so. I think it's average at best, shallow and flawed at worst. I think the reason it's scoring so highly across the board boils down to three factors:
1) it's different - it's been years since a fundamentally original FPS with a large base of players has come out.
2) Blizzard has aOverwatch is popular, and it scores highly. Is this because it's a mind-bendingly great game? I don't think so. I think it's average at best, shallow and flawed at worst. I think the reason it's scoring so highly across the board boils down to three factors:
1) it's different - it's been years since a fundamentally original FPS with a large base of players has come out.
2) Blizzard has a fantastic marketing team. I think the shorts are better than the actual game. They've really created a world that is exciting and interesting.
3) Blizzard has some pretty devoted fanboys/girls. Many companies have blindly devoted and un-objective fans, and Blizzard is no different. It helps that this is their first new IP in ages, as well as Blizzard's first foray into the FPS market.

The actual gameplay? It's alright. I was never a fan of asymmetric competitive shooters, so that doesn't help. In general I find the game to be just... decent. Not bad at all, but not great either. I played every character in the beta for a few hours, and I can tell this will be another game that I play for a few weeks and then slowly stop once the buzz wears off. It is fun to play with friends, I'll give it that. Just don't expect it to be the greatest thing ever.… Expand"
68,ElCantanteMudo,"May 26, 2016",10,"Que estamos valorando aqui? Un videojuego.
Un videojuego para ser bueno, como debe ser? Divertido.
Como es Overwatch? Divertido. Extremadamente divertido."
69,Clarion,"May 26, 2016",2,"Just another generic team FPS that really brings nothing new to the genre. Add microtransactions over an already full priced game and you have a powerful cash machine. Since Blizzard fans are already in ""farm status"" for the company, they can keep releasing low effort software like card boards, MOBAs and team FPS and making a lot of money. Good for them, bad for the videogame market'sJust another generic team FPS that really brings nothing new to the genre. Add microtransactions over an already full priced game and you have a powerful cash machine. Since Blizzard fans are already in ""farm status"" for the company, they can keep releasing low effort software like card boards, MOBAs and team FPS and making a lot of money. Good for them, bad for the videogame market's overall creativity.… Expand"
