,names,dates,scores,reviews
28,Ginnko,"May 26, 2016",9,"I won't say that this game is perfect. Granted there isn't a boat load of content for it RIGHT NOW. Having said that many people don't look past their initial impressions and dive deep into really looking game they decide to pay $60 dollars for. I have read reviews of people who when into Overwatch having not played the beta, having not seen game play, having not done any sort of researchI won't say that this game is perfect. Granted there isn't a boat load of content for it RIGHT NOW. Having said that many people don't look past their initial impressions and dive deep into really looking game they decide to pay $60 dollars for. I have read reviews of people who when into Overwatch having not played the beta, having not seen game play, having not done any sort of research whatsoever and rated it obscenely poorly because they felt gypped when it was clearly their own fault for a poor allocation of their funds. $60 dollars is a lot. Is this game worth that much? I can't say that everyone would feel that way at least now but that doesn't affect that I feel the gameplay, the visuals, the score and the fun isn't worth the time and money I have put into it. There is more to come and many consumers haven't bothered to check that there isn't going to be 'only' 21 characters. They will be releasing more as the game's life cycle grows completely free. I can't imagine that the map count would be any different especially since that seems to be the way map content in games is shifting. I didn't see anyone complaining about 343 giving out all of their maps in Halo 5 for free. Another gripe I have been seeing is the lack of anything unlock-able. I get that. But if that is all that drives you play Call of Duty, play Battlefield. Don't come into a game with preconceived notions that have no basis because you decided not to check it out before you blew your money and called it a crap game. It just makes you look stupid. All in all, this game is great. $60 dollars is a lot for a game period. For this game maybe a little more than that but wait it out. Do your research. Feel it out. Play it at a friends house first and if you don't like it, don't get it. If you do then sweet! You have a ton of people to play with that I know will be enjoying it just as much as you. This game is great. Lacking in a ton of content at the moment but when has Blizzard not been known to put out more? It'll come soon™. Definitely worthy of a high score.… Expand"
29,wewex007,"May 26, 2016",10,"I played the battleborn beta and didn't like it so I came in thinking that OW would be just as bad. Well I am so glad that I downloaded the beta and got to play because this game is EPIC! i love shooters like bf/cod and I absolutely looooove this game and here's why.
1. the mechanics/movement/ are superb in my opinion. all the characters play/feel different since they are all differentI played the battleborn beta and didn't like it so I came in thinking that OW would be just as bad. Well I am so glad that I downloaded the beta and got to play because this game is EPIC! i love shooters like bf/cod and I absolutely looooove this game and here's why.
1. the mechanics/movement/ are superb in my opinion. all the characters play/feel different since they are all different sizes and have different abilities so there is a character for everyone, which brings me to my second point.
2. Diversity. the fact that i can choose from 21 completely different characters that have different looks, feels, abilities, play styles is probably one of the best features about this game. your not just a generic soldier amongst other generic soldiers, each character was well thought out by blizzard.
3. art style: the art style and animations of each character truly bring them to life and make for very interesting personalities.
4. gameplay: the gameplay in my opinion is really really fun because you can play however you want. I'm not the type to go all out and be in the front lines so a support character like Mercy is the one for me. I can do my part by standing in the sidelines and provide support for those who need it. The good thing is since there are offense/defence/tank/support everyone will be able to find a play style that suits them.
5. one price: so far blizzard has said that for the $60, all the dlc and heroes will be includes which is refreshing to hear since companies want to charge up to $50 for new maps/features which is ridiculous (looking at you cod). overall i do think this game should be played with people you know because you have to have a well balanced team with different abilities. can't wait for Monday :) let the watch begin!… Expand"
30,Viscari,"May 26, 2016",6,"Too many imbalances. I cant see how people can score this a 8+. Two of the tanks can 1 shot... while having 3 times as much health as everybody else. Most of the heroes have an ult which is basically a cheap kill button...

Two have auto aim ults, really Blizzard? and most have an ult that will guarantee 3 kills at least.. Then we have a healer than can resurrect all nearby downed heroesToo many imbalances. I cant see how people can score this a 8+. Two of the tanks can 1 shot... while having 3 times as much health as everybody else. Most of the heroes have an ult which is basically a cheap kill button...

Two have auto aim ults, really Blizzard? and most have an ult that will guarantee 3 kills at least.. Then we have a healer than can resurrect all nearby downed heroes instantly undoing a lot of work with 1 button... Tbh I feel the ultimate abilities ruin what could be a great game.

This game does not stand a chance of surpassing games like TF2, while it contains an I WIN button for every hero.… Expand"
31,Zep188,"May 26, 2016",10,"Overwatch, a game that, for some, feels like a complete rip off of TF2, has others enjoying the game for what it is and how it takes old ideas and refreshes them in Blizzards new arena shooter.

Some people have problems with the tick rate (20)  some have problems with blizzards ""favor the shooter"" mechanics, some have problems with ultimate abilities and the new cosmetic crates thatOverwatch, a game that, for some, feels like a complete rip off of TF2, has others enjoying the game for what it is and how it takes old ideas and refreshes them in Blizzards new arena shooter.

Some people have problems with the tick rate (20)  some have problems with blizzards ""favor the shooter"" mechanics, some have problems with ultimate abilities and the new cosmetic crates that blizzard wants you to pay for (although you get them passively through just playing the game and each crate costs under a dollar if you're impatient) but nobody can deny that the game is fun without sounding a little spiteful

I'm here to tell you like it is, and this comes from a TF2 player with roughly 2000 hours of TF2 played, from the beginning (0 itemization on TF2 characters, no hats, no metal, no keys, no crates, etc.) to roughly 2 years ago, when the game became a drag for me.

When I look at Overwatch I see a lot of characters that are deeply rooted in TF2 characters simply because of how the character works and what role they play. However, these characters are generally acceptable because they have abilities that distance themselves from other playable classes in other games. I will not be drawing direct comparisons because if you look at the characters you can draw these lines for yourself. What I am willing to say is that imitation is the best form of flattery.

What I will also say is that what happened at Blizzards round table is obvious. Blizzard took a look at old games, took what they enjoyed best and what worked best to them, and decided to implement those things in their WIP; and there's nothing wrong with that. What you will mainly see in these reviews are people that are mad about characters that are obviously easier to play for new players (bastion, reinhardt etc.) and call out the nerf hammer or just say ""it's a rip off and it costs money oh and I'm bored already"" and just dismiss the game, which 350 have done, and they have every right to, but in my eyes it is a great injustice.

The first time I played Overwatch, which was in the free beta not too long ago, I played solo most of the time, as i still do. I swapped my characters when I felt I should based on the enemy team and found who I was proficient at and who I wasn't, which I feel should be every new players intention. I did draw conclusions as to who acted similarly to TF2 characters and was amazed at the new abilities and new ideas that blizzard brought to the table. Yes, you have Roadhogs hook which is like Pudge from Dota, or Blitzcrank from league, but this is new ground in an arena shooter, and it is equally as satisfying. What I didn't do was become bummed out at similarities that I found; I actually enjoyed these similarities because that's what I enjoyed from previous titles as well, even if they were from different devs.

What I noticed next was the fluid motion of characters and how smooth everything played out. Yes, I was flash banged by a Mccree many times, which causes a break in the action, and Mei did freeze me quite a few times, but it didn't make me rage, it made me want to think. Instead of figuring out which hat i was going to wear in TF2 I was actually thinking about how i can get around certain characters and what character I should play in order to beat the opposition and win. NOT get the most kills.

One of the last things I noticed was the play of the game (POTG) which, sometimes, I admit can be a let down, but ultimate abilities are very satisfying to successfully use. You will find many players getting upset at ""broken"" ultimates but as time passes players adapt, this is also where individual player skill comes in, yes, even with Soldier76's aimbot. In short, even the most seemingly broken ultimate requires timing and a bit of finesse in order to catch more seasoned players out.

All in all I'm having fun with Overwatch and will continue to do so in the foreseeable future. I endorse both solo play and playing with friends. I enjoy the graphics and the mechanics. I enjoy the learning curve and most if not all of the maps currently available. Blizzard may not have made the most original arena shooter ever but it doesn't deserve the rap it gets from the peanut gallery.

TL;DR, don't listen to the angry TF2 fanboys, trolls, and naysayers who caused this game such grief simply because they outright dismiss the game for having a few issues, and certainly don't let it put you off of getting the game. This game holds its own. In reality this game is a 9.2 in my book, but i'm giving it a 10 to counteract some of these unbelievable reviews and dismissals. Ridiculous.… Expand"
32,BottyBotsworth,"May 26, 2016",6,"It would be better if it had more game mode than escort and king of the hill. Hell, it'd be better if you could queue for one of those game types but as it is now I regret buying this game. There are only 3 heroes I enjoy and most of the heroes feel really bland to me. The graphics are solid as well as the animations. The game play feels lacking.

Really wish there were ways to modifyIt would be better if it had more game mode than escort and king of the hill. Hell, it'd be better if you could queue for one of those game types but as it is now I regret buying this game. There are only 3 heroes I enjoy and most of the heroes feel really bland to me. The graphics are solid as well as the animations. The game play feels lacking.

Really wish there were ways to modify your heroes such as equipping them with certain gear to increase stats. Playing as mercy I feel like I cant heal any form of damage making her completely moot unless the other player runs away which is a terrible idea for both game types.… Expand"
33,Infynis,"May 26, 2016",10,"I'm usually not a fan of FPS games, and when I first saw Overwatch, I thought ""Ew, I don't want to play a cartoony game with a monkey character,"" but I eventually went back and looked into it more, and then I played it in the open beta, and now I've played it at full release, and it has become one of my favourite games of all time. The team-play is fantastic, the lore and heroes areI'm usually not a fan of FPS games, and when I first saw Overwatch, I thought ""Ew, I don't want to play a cartoony game with a monkey character,"" but I eventually went back and looked into it more, and then I played it in the open beta, and now I've played it at full release, and it has become one of my favourite games of all time. The team-play is fantastic, the lore and heroes are amazingly interesting and robust, and the gameplay is still riveting literally hundreds of games later. Blizzard has knocked it out of the park with this game. And by the way, he's not a monkey, he's a scientist.… Expand"
34,Brogam4r,"May 26, 2016",0,"What pretty much everyone else said. Could be ok for a few hours if it was free to play, but this crap really doesn't cost 40 bucks. Its also such a blatant ripoff of tf2..."
35,batson456,"May 26, 2016",7,"The game is polished, I will give it that much. Unfortunately, that is about the extent of the appeal here. It is pretty much an exact copy of TF2 mixed with MOBA. I enjoy derivative games for the most part, we have to be real here, nothing is original, and good twists on old genres can be awesome. The real problem is that the game is just so boring! I played for a few hours, and at first,The game is polished, I will give it that much. Unfortunately, that is about the extent of the appeal here. It is pretty much an exact copy of TF2 mixed with MOBA. I enjoy derivative games for the most part, we have to be real here, nothing is original, and good twists on old genres can be awesome. The real problem is that the game is just so boring! I played for a few hours, and at first, was fairly impressed. I enjoyed how smooth everything was, the shooting was fantastic, the motion was fast and fluid. I played about 20 games or so, and then I just realized, I had no interest to play another. The game felt ludicrously shallow, strategies were the same from match to match, and each match pretty much unrolled exactly the same way. Evolve, as much of a flop as it was was infinitely more replayable and entertaining than this game. I don't understand the amount of love this game is getting, but if you enjoy it, more power to you! That is what opinions are for, just sadly not the game for me.… Expand"
36,GordoBlue,"May 26, 2016",9,"Some people who are giving negative reviews either don't understand what the game is or are just being ignant.

1. Blizzard never marketed this game to have a campaign. If you saw any article pre-release, which was pretty hard to avoid, as advertisements were (and are) everywhere, you'd know that Overwatch is a multiplayer-only game. No one EVER said that this game was going to have aSome people who are giving negative reviews either don't understand what the game is or are just being ignant.

1. Blizzard never marketed this game to have a campaign. If you saw any article pre-release, which was pretty hard to avoid, as advertisements were (and are) everywhere, you'd know that Overwatch is a multiplayer-only game. No one EVER said that this game was going to have a single player campaign.

2. People are complaining about the game having no competitive mode at launch. This is a valid point, although the strategy Blizzard went with isn't horrible. Many people gave feedback during the beta about how to improve the ranked and spectator systems, and Blizzard are still working on it. As a personal opinion, I don't mind that they launched the game without competitive ONLY because it is launching so soon after release; competitive's release is slated for the end of June. I've been having fun in quick play learning how the game works and how the characters play. Even if Overwatch did come with ranked at launch, I wouldn't have jumped into it without being adept at the game anyway.

3.  People are saying that the game should be F2P (free to play) but they must not know what that actually entails. F2P games give you a few free characters, with other characters on a rotation that shifts every so often, and the rest (often the best ones) are locked behind a paywall. Also behind this paywall are downloadable content and everything else. Blizzard has promised all upcoming DLC (characters, maps, etc) will be free. In the end, a one-time payment with all content included in the purchase is better than a F2P model.

4. I've read several reviews about the game being aimed at casual players and/or lacking content. These arguments are misguided. First off, this game has a lot of depth and a high skill ceiling. In the coming months, people are going to start finding new tech and new ways to use characters that will only push the ceiling higher. Like Rocket League or Super Smash Bros Melee, Overwatch can be a sort of party game that low-level players can enjoy, but also a game with huge esports potential. If Blizzard can listen to the community and get the ranked/spectator systems right, Overwatch could gain a large esports following. Second, the game has one unranked mode, training, custom games, and an ""arcade"" mode, which some suggest constitutes a lack of content. I agree that the game is lacking content, but what people fail to understand is that a ton of content =/= a ton of replayability. The core game mechanics of this game make every match feel fresh. The objectives are the same, but the way I've been approaching them is different every time. There are so many different viable team compositions and ways to play that Overwatch's replayability is massive. I'll use Rocket League again as an example, and this counts for all sports games as well: The maps are the same, the objectives are the same, but every match feels different because the games' mechanics allow the player to be creative in how they approach them, and it's past-paced and just plain fun.

This is my unbiased opinion (I've never played a Blizzard game before and therefore have no company loyalty) and I hope this helps people to understand why this game is so good.… Expand"
37,Steamrider86,"May 26, 2016",1,"Game is fun! Love the characters, design, and often best to play with teams and friends. The downside, although minor, is the lack of content. Just run and shoot. If you play TF2, try out Overwatch. Its a hella fun. And lol, Its not flawless as how gameinformer puts it, but it holds its own as a new IP from Blizzard.."
38,StarScream2092,"May 26, 2016",6,"It all depends on what you are expecting from a game. Overwatch is a solid FPS based on spells and objectives. However it gets repetitive and it does not have any Single player story mode. If you are a person that can play same thing over and over with great character design this is for you. People still play League of legends but there is item variations so that can be different everyIt all depends on what you are expecting from a game. Overwatch is a solid FPS based on spells and objectives. However it gets repetitive and it does not have any Single player story mode. If you are a person that can play same thing over and over with great character design this is for you. People still play League of legends but there is item variations so that can be different every match. Cs:Go also have repetitive gameplay but i think people are driven by learning skill and mastering shooting. In overwatch you cant swap weapons and skins are not that great too. Most of them are just recolors. Blizzard knew this game have shallow game mechanics but well polished, they even wanted to put it as free to play. But then they saw hype is building up, and understood they can charge people for that. Usually people who played 4 - 6 hours (total gameplay) say it is awesome. They are expecting that there is a lot more content they did not discovered yet. But in reality that is all.… Expand"
39,FrapRoast,"May 26, 2016",10,"PC version review. Runs perfectly with my mid range PC on high. I can't say enough good things about this game. Every match is fun and feels like either side could win. Almost all the characters feel balanced and when I feel that I'm being countered by someone I can just switch to someone new. having no campaign isn't a downside for me as the game never pretended it was going to have one.PC version review. Runs perfectly with my mid range PC on high. I can't say enough good things about this game. Every match is fun and feels like either side could win. Almost all the characters feel balanced and when I feel that I'm being countered by someone I can just switch to someone new. having no campaign isn't a downside for me as the game never pretended it was going to have one. lack of content at first seems like a shortcoming but the promise of free characters, maps, and game types makes up for that.

Pros
- Runs silky smooth
- Always fun and never frustrating
- Characters are diverse, fun, and balanced
- Free updates in the future (only microtransactions are cosmetic)
- Great to play solo and even better with friends

Cons
- lack of single player may be a con for some… Expand"
40,crnppscls,"May 26, 2016",9,"I'll keep it short.

It's a team shooter that uses the trinity ethic. If you play healers in mmo's etc then you'll feel right at home playing a character like Mercy. Buffing,tanking and healing are fundamental to the success of the team and points are awarded for performance, not just kills.

The stylized character models and settings may not appeal to some but underneath there is aI'll keep it short.

It's a team shooter that uses the trinity ethic. If you play healers in mmo's etc then you'll feel right at home playing a character like Mercy. Buffing,tanking and healing are fundamental to the success of the team and points are awarded for performance, not just kills.

The stylized character models and settings may not appeal to some but underneath there is a simple, professionally made game and engine that you want to get to know better.

It's not going to win any prizes for innovation, although the characters require diverse playstyles and the maps are outstanding. There is stuff that looks like it's been directly lifted from Tf2.

You can play vs bots to hone your skills or test out characters so there is no fear of underachievement while finding your niche.

It's just a good fun game that you can pick up instantly and be successful with a little forethought to your objective… Expand"
41,Reckless39,"May 26, 2016",6,"WARNING! A LOT OF TEXT! MOVE TO THE END OF THE REVIEW TO GET A SHORTER VERSION OF IT!
1. Yet another online shooter that doesnt include blood, gore etc. for only reason: more ages are allowed to play - more money. It is way too happy and sunny game for such jenre - it is about freakin war so blizzard decided to sell to kids a game about smth as horrible as war.
2. Gameplay was veryWARNING! A LOT OF TEXT! MOVE TO THE END OF THE REVIEW TO GET A SHORTER VERSION OF IT!
1. Yet another online shooter that doesnt include blood, gore etc. for only reason: more ages are allowed to play - more money. It is way too happy and sunny game for such jenre - it is about freakin war so blizzard decided to sell to kids a game about smth as horrible as war.
2. Gameplay was very repetitive for me. So I couldn't take more than an hour a day of this ... shooter. I was trying like 5 heroes a day but in the end you will have to choose the hero that your team need to win. So I always must play heroes with extremly boring gameplay for me in order to get a win.
4. It was also surprising for me that a game with small maps and little players number has such system requirements. I can only hope this was and intended feature of the game's engine so that it will develop more efficient or smth like that.
3. They were making a free to play game, but when the main development was over they made a f2p game cost 40$! So basically it is a worse quality game because it was meant to be free, but they unlocked donation content so you have to pay for it a lot.
After all, I can say that this game wasn't innovative or addictively fun to play. I gave a 6 to this game, cause it also has quite intresting story for each character, but it is completely ignored in the game, when everybody is killing each other with no lore reason and there can be 2 and more same heroes at the same time on the batlleground, so it was the same mistake like in heroes of the storm. I wonder how the game could've be if there were 2 opposite alliances of heroes like in wow, and the battlegrounds were actually some sort of scenarios and had at least some kind of intro for them on the loading screens.
Simple version of the review: meh.… Expand"
42,OctavioJS,"May 26, 2016",9,"No se dejen llevar por las malas críticas, el juego irá creciendo con el tiempo y junto con su comunidad para ir entregando mejor contenido.
Pros
-Adictivo y fácil de aprender
-customización de los héroes
-variedad de estrategias de cada héroe y en conjunto
-requiere trabajo en equipo
-gráficas simplistas pero a la vez detalladas y caricaturescas al estilo Pixar
-el soundtrack esNo se dejen llevar por las malas críticas, el juego irá creciendo con el tiempo y junto con su comunidad para ir entregando mejor contenido.
Pros
-Adictivo y fácil de aprender
-customización de los héroes
-variedad de estrategias de cada héroe y en conjunto
-requiere trabajo en equipo
-gráficas simplistas pero a la vez detalladas y caricaturescas al estilo Pixar
-el soundtrack es muy bueno

Contras:
-Puede que al principio no sientas que tiene mucho contenido, se recomienda jugar con amigos
-difícil adaptarte a héroes o dinámicas del juego si no conoces nada acerca de arena shooters o trabajo en equipo… Expand"
