,names,dates,scores,reviews
70,Blackcesar,"May 26, 2016",9,"Note: I've played the beta and first day at launch so rating can change further in time.
Overwatch is an Arena Team Based Shooter with MOBA skills into it, so making comparisons with Battleborn makes no sense. That being said, the game is solid. Graphics are cartoonish and stylish, especially noticeable is that you will always understand what is going on on your screen and that's reallyNote: I've played the beta and first day at launch so rating can change further in time.
Overwatch is an Arena Team Based Shooter with MOBA skills into it, so making comparisons with Battleborn makes no sense. That being said, the game is solid. Graphics are cartoonish and stylish, especially noticeable is that you will always understand what is going on on your screen and that's really important in a game like this. Content-wise there is not so much right now but I do think that is not a real problem, first because Blizzard is always updating their games, second because what is important is the gameplay.
Gameplay-wise is where Overwatch shines the most. Fast-paced, skill-based and team compositions are fundamental aspects of the game, so it is highly recommended to play with friends. Each character feels unique and needs a different degree of training to be properly used, also the idea that you can swap characters during the match makes counter attacks much easier and avoids unnecessary boredom from people who cannot use that specific hero, if you are not good, you just change to someone more suited and go right back into the action. Apart from balanced issues (get ready to be headshoted everywhere by Hanzos in a few weeks) one problem is the absence of the sprint button for all heroes (apart Soldier 76), this leads to long walking times, but at the same time, it allows to be careful to engage because you cannot run so quickly off the action. Maps are pretty easy to memorize but have some nice ""twists"", like certain areas can be access quicker only by some heroes, increasingly the importance of a balance team.
I still have to understand how Blizzard was able to develop a game that feels ""easy"" in both the mechanics and the settings while still having a lot of depth, the game designers are pretty good at their jobs I would say,
Overall, Overwatch feels like a really polished game. Matchmaking is fast (only one time had connections problem and always zero lag at day one). Grab a couple of friends and jump in, this game will stay on the market for a long time so no worries about new content.
ps:I guess there is no need to say how user reviews with score 0 are useless.… Expand"
71,Ouideau,"May 26, 2016",9,"Peoples who gives 0 are working for 2K and Battleborn. My condolences.

Great game, great multiplayer. A solo campaign doesn't make any sense in this type of game and gameplay.
The game mods are original and works well with the level design.

Obviously, I hope for more maps, mods and heroes soon.
But : 21 heroes, 12 maps,  4 game modes, it's not so bad. That's enough for 100+ hours.Peoples who gives 0 are working for 2K and Battleborn. My condolences.

Great game, great multiplayer. A solo campaign doesn't make any sense in this type of game and gameplay.
The game mods are original and works well with the level design.

Obviously, I hope for more maps, mods and heroes soon.
But : 21 heroes, 12 maps,  4 game modes, it's not so bad. That's enough for 100+ hours.

I can't put a 10 because the game need ranked games. Blizzard is working on it and hopefully it's released in end of June !… Expand"
72,Yort515,"May 26, 2016",9,"I want to preface by saying that while have played a number of multiplayer fps games i have not been excited for one in a very long time. I had heard of Overwatch prior to release but didn't think much of it and was not impressed by the footage i saw. I decided to try the open beta prior to release after hearing the hype around the game, I was soon hooked. Overwatch is one of the mostI want to preface by saying that while have played a number of multiplayer fps games i have not been excited for one in a very long time. I had heard of Overwatch prior to release but didn't think much of it and was not impressed by the footage i saw. I decided to try the open beta prior to release after hearing the hype around the game, I was soon hooked. Overwatch is one of the most solid games I have played at launch and of of the most enjoyable multiplayer games I have played. The graphics while not mind blowing are still beautiful and the art direction has the Blizzard charm that they are known for.  All the character play differently from one another and are fun to play with enjoyable personalities to boot. the gun play is arcade like  but in a good way, all the mechanics are well balanced among the 21 heroes at lunch. My only issue with the game as of right now is map variety and game mode variety. None of the maps are bad but since they are small compared to other fps games it would be nice to have more locations. It would also be nice to see some more game modes down the road maybe ctf  of something similar to conquest with slightly larger maps. My issues with the game are minor gripes and are something that will be addressed as the months and years roll around. I encourage many people to purchase the game, particularly on pc since the base game is 40 bucks.… Expand"
73,Underclass,"May 26, 2016",10,"Amazing game from amazing company. It's a lot better than all FPS shooters like CS and also it's even better than games like DOTA 2. Different heroes, nice maps, interesting customization and really good optimization."
74,Juch,"May 26, 2016",9,"The most fun game I have played in a long time. This game is action packed from the very first moment you log in. The game is highly dynamic, due to the online multiplayer part and the dynamic choice of heroes. The game feels balanced, each hero provides a way to break or counter the balance and adds something unique to your team.
As a casual gamer, I can easily log in, play for 30 minsThe most fun game I have played in a long time. This game is action packed from the very first moment you log in. The game is highly dynamic, due to the online multiplayer part and the dynamic choice of heroes. The game feels balanced, each hero provides a way to break or counter the balance and adds something unique to your team.
As a casual gamer, I can easily log in, play for 30 mins and log out again. The 30 mins are full blown packed with fun & action. (No start up time, grinding, or time lost in other ways). However, I can easily see myself play for hours at a time, if my schedule would allow for it.
Best FPS out there, reminding me of the good old fun of the old Quake mixed with role-based features and highly cooperative. Good job Blizzard.… Expand"
75,Weng,"May 26, 2016",9,"After waiting over two years for this game I can finally say the wait and excitement paid off. I've never really played a Blizzard game before this as they've never produced anything that really has much appeal to me but here Blizzard have created something that I can finally sink well over 1000 hours into. The gameplay is fun, fast and frantic and there's never a dull moment. The game isAfter waiting over two years for this game I can finally say the wait and excitement paid off. I've never really played a Blizzard game before this as they've never produced anything that really has much appeal to me but here Blizzard have created something that I can finally sink well over 1000 hours into. The gameplay is fun, fast and frantic and there's never a dull moment. The game is also quite cheap when compared to most AAA titles these days, the game is about £30 with £40 for the special addition. On top of this the micro transaction system is perfectly done with them being completely optional for those who want to get cosmetic items fast. My only gripe with the game is that there is no voting system currently in game so getting rid of an afk person or mic spammer is near impossible. There is also a strange leavers penalty system that I don't feel belongs in the quick play section of this game as it feels very drop in, drop out, I can understand why it would be there in competitive mode but not in the casual ones. I myself am also experiencing strange connection issues where I suddenly lose connection to the server but this seems to be happening to only a small amount of people and Blizzard have stated they are working on a fix.

TL:DR - Games good, buy it, like, right now… Expand"
76,MossDeffxRus,"May 26, 2016",10,Best game in this genre! Amazing dynamic & balanced heroes. The mechanic of the game is really exciting & force you to fight harder for victory/ I will play this game every day for years!
77,345Y,"May 26, 2016",7,"Overwatch really is fun. The graphics are cool and doesnt not try to go with ""one of the best looking game ever"" style. It is competitive and the different characters are well thought. Although this multiplayergame is near perfect I give a 9/10 for this game. Because I am missing two little things that dont disturb the gamestyle at all.

1. Character customiziation: I dont need differentOverwatch really is fun. The graphics are cool and doesnt not try to go with ""one of the best looking game ever"" style. It is competitive and the different characters are well thought. Although this multiplayergame is near perfect I give a 9/10 for this game. Because I am missing two little things that dont disturb the gamestyle at all.

1. Character customiziation: I dont need different ""victory poses"" and actually: I find the totally useless as the feeling when you open a lootbox and you only get **** sprays or pose (especially when you see some epic or legendary reward) you are disappointed.
2. And furthermore I would like to have a bit more options of customiziation (I dont want to open the comparision to Team Fortress 2 - but you get the point). Something that changes the style HOW you play. This wont happen by the skins you get. Some new weapons with small damage changes or buffed abilitys would make me happy as I would think more of options and new methods, which will make a game perfect for me: Thinking of how you like to play and what small changes make the perfect gamestyle for you.

Still, the game is absolutely stable, makes fun and looks nice. So, like I said before, I give it a 9/10.

Thanks for reading.… Expand"
78,onframe,"May 26, 2016",10,"great game. That a simple mix of all ideas of final years. Remember one thing, that's only beginning of this game.And this beginning was great. Play and have fun. Peace for all"
79,Vincealot,"May 26, 2016",10,"I played this game a lot during the beta and now that its live i play it even more.
If they (as promised) continue adding maps and eventually heroes its going to be even more awesome"
80,legendaRUS,"May 26, 2016",10,"Шикарная игра. а всякие нищиброды и школьники идите лесом, играйте в доту.
А теперь по сути, Overwatch — динамичный, увлекательный и небанальный классовый шутер. Отличная графика, удивительная история. Близы нам дали очередную вселенную, по которой я уверен через лет 5 снимут очередной фильм.Шикарная игра. а всякие нищиброды и школьники идите лесом, играйте в доту.
А теперь по сути, Overwatch — динамичный, увлекательный и небанальный классовый шутер. Отличная графика, удивительная история. Близы нам дали очередную вселенную, по которой я уверен через лет 5 снимут очередной фильм."
81,Hunter_Dragon,"May 25, 2016",10,"The newest IP from Blizz and simply put one of their most fun and addictive games, in this Team-based Arena shooter (think Team Fortress and Unreal Tournament) the amazing character designs, impressive animations and spot-on sound design mixed with very unique playstyle each and every character offers create an experiance unlike any other competitive game out there in the same genre (andThe newest IP from Blizz and simply put one of their most fun and addictive games, in this Team-based Arena shooter (think Team Fortress and Unreal Tournament) the amazing character designs, impressive animations and spot-on sound design mixed with very unique playstyle each and every character offers create an experiance unlike any other competitive game out there in the same genre (and there are plenty of them coming out, none feel as polished or fun as Overwatch).

Pros:-
◾-Beautiful aesthetic, impressive sound design and animations as well as amazing character and level designs.
◾-Very unique playstyle for each character out of the 21 available now, there are classes (tank, support, offense, defense) like in all team-based arena shooters but even within each class every character feels like a whole different beast to learn and master.
◾-Impressive assortment of cosmetics, character skins, player icons, sprays (you can put them on walls in-game), character intros, emotes and victory poses for every character.
◾-Blizzard seal of quality, game is super polished, had a very smooth launch and plays like magic with zero glitches or problems (there were few glitches in open Beta but they are gone now), expect long years of support and free content as well, after all Blizzard still release patches for their decade old games like Diablo 2 and Starcraft: Broodwar.

Cons:-
◾-Few gameplay modes, sure you can play custom and Brawl where the rules can be dramatically changed but still in Quick Play (the main gameplay mode) there are only three gameplay modes (Point Capture, Payload and Assault) and one Hybrid, it would have been great if the game released with more modes but they surely will add more in the coming updates.
◾-Some game systems could use a bit of tweaking like Play of the Game (a cool feature that saves and replays the best moment in the game for everyone to watch), a lot of times it's something awesome and exciting, other times it's mundane and even nonsensical and comical (like showing the Engineer Torbjörn dead on the floor while his turret is doing all the kills), a few tweaks to the algorithms of how PotG is selected would prevent such silly things from happening.

Two last things regarding the idiots panning the for the most stupid and retarded reasons, all of the cosmetic stuff in the game you can earn by just playing and leveling up, if you are impatient you can buy extra loot chests to get stuff faster, but nothing obliges you to do so, basically don't listen to the idiots who are whining about loot boxes shop, it's 100% optional and the game offers loot boxes at a steady rate every level up (there is no level cap, level exp requirements flatline at lv.22 and reset every 100 levels), Mass Effect 3 Multiplayer used the same exact system and it worked great, that money will help keep the game alive for years and support all the costs of adding new free heroes, new maps, play modes and features  (and pay server maintenance costs), i don't see any reason whatsoever to complain about the loot boxes shop, unless you just want to troll.

2nd, i can't believe this site still allows zero score reviews, it is beyond ridiculous how some people acting like 5 years old bullies who might not have even bought or played the game can just write a pile of hateful crap and it somehow that **** counts as a review, the one affected most negatively by this utter lack of criteria for reviews is actually the site itself.

If you like Team-based arena shooters, a big fan of Blizzard games or just want to try a multiplayer game that's fun, polished and addicting go buy this game right now.… Expand"
82,scooter2,"May 25, 2016",10,Awesome stuff blizzard. Would of loved for overwatch to have a fun story mode with these amazing characters. Still doesn't change its a perfect game. 10/10 for me :)
83,Evtrex,"May 25, 2016",7,"Blizzard's hybrid is far from being ''Best PC Game of 2016''. It does not incorporates anything new to the industry. It is just another monotonous multiplayer game. While the game feels completed overall(from maps, characters, and settings) compared to any free to play. Great servers, incredible response time, and no lag at all(even at the highest settings). So basically does what isBlizzard's hybrid is far from being ''Best PC Game of 2016''. It does not incorporates anything new to the industry. It is just another monotonous multiplayer game. While the game feels completed overall(from maps, characters, and settings) compared to any free to play. Great servers, incredible response time, and no lag at all(even at the highest settings). So basically does what is supposed to do. It is not a game changing in any way. From that perspective it couldn't been worst because nobody knows how is going to be before the end of the year. It can change for better or not change at all, if that is the case I will be very disappointed, thus making it a just-for-the-moment experience. Blizzard is risking a lot with this game at the same time we are too by putting our money into it. So the game is a bomb just hope for the best to keep it out of our side because we don't know when is going to explode.… Expand"
84,Scypheroth,"May 25, 2016",1,"For me this game was a **** show...the screen was constantly being blocked by explosions. Constant deaths and sheer stupid match making...a very boring game in my books...quickly refunded it and never looking back...if your looking for a FPS this isnt your game move along. The only good thing about this ""game"" are the mini movies that came out before the game...more of thous would be great..."
85,Hoondarrh,"May 25, 2016",10,"Nice shooter!
I was years without play FPS games and this one made me get back to this genre.
I have no complains about Overwatch right now and hoping for new content in future."
86,Ricollo1324,"May 25, 2016",10,"Overwatch brings the asymmetrical FPS genre to an entire new level. Each character is a completely different experience, and even though some of them may seem overpowered, as Bastion or Mei, it's completely up to developing your skills as a player and having fun. A MUST PLAY"
87,diagoraz,"May 25, 2016",10,"Game is not perfect, but close. Munch stylized graphics, superb voice acting, mechanical sensational, fun, affordable and very well optimized.. I did not expect much of the game, but Blizzard surprised me completely. Recommend!"
88,Bacontron,"May 25, 2016",10,"Proberly the best shooter i have played for many years. It takes the best of old TF2 and matches it with the good parts of Monday Night Combat.

I really enjoy this game, like a huge amount. Since it is not a free-to-play game, i am looking forward to a good amount of new free maps, modes and hopefully heroes in the coming year. As with Diablo 3, it is proberly going to become a betterProberly the best shooter i have played for many years. It takes the best of old TF2 and matches it with the good parts of Monday Night Combat.

I really enjoy this game, like a huge amount. Since it is not a free-to-play game, i am looking forward to a good amount of new free maps, modes and hopefully heroes in the coming year. As with Diablo 3, it is proberly going to become a better game in the following years, so its only good to start out early.

Buy it now, if you have the money! :D… Expand"
89,Rtrochford90,"May 25, 2016",10,"Great game. Plays like team fortress 2. Honestly, feels like it should only cost about $20, but a) this is a review of how good the game is, not how much content it packs, and b) blizzard has a good reputation for supporting games, and that has some value.

Graphics are great, gun play is great, battles are diverse...need to team up. No story mode, but what it does, it does perfectly. 10/10"
90,TokaJei,"May 25, 2016",10,"I don't write reviews on Metacritic.  This will probably be my only one.  The only reason I made an account and reviewed this was to respond to the ludicrous criticism on the lack of content.  This game has the perfect amount of content right now.  21 diverse heroes all with immense strategic depth.  There are 12 maps, and I haven't played any of them thinking ""this map is meh, I don'tI don't write reviews on Metacritic.  This will probably be my only one.  The only reason I made an account and reviewed this was to respond to the ludicrous criticism on the lack of content.  This game has the perfect amount of content right now.  21 diverse heroes all with immense strategic depth.  There are 12 maps, and I haven't played any of them thinking ""this map is meh, I don't like it when it comes up.""  They are all amazing.  Each part of a map is a strategic opportunity for a hero.  There are 3 game modes.  This is an excellent recipe for a COMPETITIVE game---which is exactly what Overwatch is.  In a competitive game, you don't want 10 different game modes and 30 different maps.  With that much content, it is hard to learn map layouts and game modes and their respective strategies.  And by learn, I'm not talking casual learning where you feel like you know the game pretty well after several hours of play.  I'm talking about hundreds of hours of play on each map and each game mode and with each hero.  This is how you are supposed to approach competitive games.  You need to embrace the ""lack of variety"" (although Overwatch is the polar opposite of lack of variety) and instead focus on being better than everyone else at maps, modes, heroes, and other elements of the game.  A good reference for this concept is League of Legends.  That game has been out since 2009 and for mainstream competitive play (so not counting Twisted Treeline) there is only one map and one game mode---and that is a large part of LoL's competitive success.

People also complain that this game has no single player element.  Well it actually does.  The Practice Range.  It's a great place to study a hero's mechanics.  This is a must for a competitive game.  What this game doesn't have is a single player campaign.  It doesn't need one in my opinion, however if Blizzard added one in the future I wouldn't complain.  I know it'd be pretty dope.
Now for the review of the game itself.  Not going to spend much time here.  It's extremely fun.  The replay value is insanely high (per the first paragraph).  Each hero is very unique and plays in their own way.  You can dump hundreds of hours into a hero and will still need to work on other heroes, since the game is designed to encourage switching heroes mid-game depending on the situation at hand.  Even if that's not the case, you will want to benefit from a diverse team so only sticking with one or two heroes will still stifle your playing potential.  The gameplay is very fun and diverse as well.  No two matches feel alike.

I have found nothing wrong with this game.  Absolutely nothing.  I like and respect Blizzard but I'm not a fanboy by any stretch of the imagination.  Their only other games I've played are Diablo III, and was only into that for a couple months (really really fun game though), and Hearthstone.  As a competitive character based game, yes some of the heroes are annoying as heck to play against but this isn't something that's wrong with the game.  This is present is any game like this, League of Legends, Dota 2, Heroes of the Storm, Team Fortress 2, you name it.

So I'm just going to list all the generic good stuff about this game that you are probably here wondering:
- Graphics/Art Style (the art style and character design is what drew me to this game).
-Gameplay
-Music/Sound (really love the soundtrack, a lot.  I'm a sucker for game soundtracks)
-Replay value
-Honestly, any other game review parameter you can think of, this game meets it.

Overall this game definitely warrants all the hype.  If you're still on the fence then I guess this just aint a game for you OR you should just watch more gameplay videos.… Expand"
91,acronym123,"May 25, 2016",10,Cool game with a lot of interesting characters and technicalities. There is a wide variety of play styles that ensure that every game will be different. The best part of the game is that there are effective counters to every hero in the game which will prevent any one hero from becoming too overpowered. Can't wait to see what else Blizzard does with their newest IP.
